### ISSUE TITLE
IKEV2 with dpddelay=10, but in fact, the sending cycle of liveness keepalives is 20s

### ISSUE THREAD

**Issue by hdlk** [libreswan/libreswan#662]
The version is libreswan-4.6, and I set dpddelay=10. Through tcpdump packet capturing, it is found that the actual cycle is 20s.

15:19:06.880774 IP 21.10.10.3.isakmp > 10.32.181.200.isakmp: isakmp: child_sa  inf2[I]
15:19:06.907697 IP 10.32.181.200.isakmp > 21.10.10.3.isakmp: isakmp: child_sa  inf2[R]
15:19:26.884617 IP 21.10.10.3.isakmp > 10.32.181.200.isakmp: isakmp: child_sa  inf2[I]
15:19:26.917819 IP 10.32.181.200.isakmp > 21.10.10.3.isakmp: isakmp: child_sa  inf2[R]
15:19:46.883214 IP 21.10.10.3.isakmp > 10.32.181.200.isakmp: isakmp: child_sa  inf2[I]
15:19:46.917630 IP 10.32.181.200.isakmp > 21.10.10.3.isakmp: isakmp: child_sa  inf2[R]

The log at 15:19:16 is as follows:
Mar 21 15:19:16.881798: | timer_event_cb: processing EVENT_v2_LIVENESS-event@0x55a0120260 for CHILD SA #2 in state ESTABLISHED_CHILD_SA
Mar 21 15:19:16.881901: | #2 deleting EVENT_v2_LIVENESS
Mar 21 15:19:16.881928: | delref tt@0x55a01202b0(1->0) (destroy_timeout() +585 programs/pluto/server.c)
Mar 21 15:19:16.881950: | delref state-event@0x55a0120260(1->0) (timer_event_cb() +227 programs/pluto/timer.c)
Mar 21 15:19:16.881989: | kernel: get_sa_info esp.d04325a@21.10.10.3
Mar 21 15:19:16.882011: | xfrm: sendrecv_xfrm_msg() sending 18
Mar 21 15:19:16.882119: | liveness: #2 scheduling next check for 10.32.181.200:500 in 10 seconds (successful exchange was 9.972834 seconds ago)
Mar 21 15:19:16.882156: | event_schedule_where: newref EVENT_v2_LIVENESS-pe@0x55a0120260 timeout in 10 seconds for #2
Mar 21 15:19:16.882181: | newref tt@0x55a01203f0(0->1) (schedule_timeout() +567 programs/pluto/server.c)
Mar 21 15:19:16.882222: | #2 spent 0.392 (0.425) milliseconds in timer_event_cb() EVENT_v2_LIVENESS

The full log is attached, and we look forward to your reply.
[pluto.log](https://github.com/libreswan/libreswan/files/8313970/pluto.log)

**Comment by letoams** [comment]
On Mon, 21 Mar 2022, hdlk wrote:

> The Version is libreswan-4.6, and I set dpddelay=10. Through tcpdump packet capturing, it is found that the actual cycle is 20s
> 
> 15:19:06.880774 IP 21.10.10.3.isakmp > 10.32.181.200.isakmp: isakmp: child_sa inf2[I]
> 15:19:06.907697 IP 10.32.181.200.isakmp > 21.10.10.3.isakmp: isakmp: child_sa inf2[R]
> 15:19:26.884617 IP 21.10.10.3.isakmp > 10.32.181.200.isakmp: isakmp: child_sa inf2[I]
> 15:19:26.917819 IP 10.32.181.200.isakmp > 21.10.10.3.isakmp: isakmp: child_sa inf2[R]
> 15:19:46.883214 IP 21.10.10.3.isakmp > 10.32.181.200.isakmp: isakmp: child_sa inf2[I]
> 15:19:46.917630 IP 10.32.181.200.isakmp > 21.10.10.3.isakmp: isakmp: child_sa inf2[R]

Can you log the size of the packets? I think these packets are not
DPD/liveness packets, but the NAT-T keepalive packets (but it is
confusing that I see "child_sa inf2" which does seem to suggest
there is more than one byte as they read the IKE header as an
informational exchange packet.

(I did not see the full log attached)

Paul

**Comment by hdlk** [comment]
> On Mon, 21 Mar 2022, hdlk wrote: The Version is libreswan-4.6, and I set dpddelay=10. Through tcpdump packet capturing, it is found that the actual cycle is 20s 15:19:06.880774 IP 21.10.10.3.isakmp > 10.32.181.200.isakmp: isakmp: child_sa inf2[I] 15:19:06.907697 IP 10.32.181.200.isakmp > 21.10.10.3.isakmp: isakmp: child_sa inf2[R] 15:19:26.884617 IP 21.10.10.3.isakmp > 10.32.181.200.isakmp: isakmp: child_sa inf2[I] 15:19:26.917819 IP 10.32.181.200.isakmp > 21.10.10.3.isakmp: isakmp: child_sa inf2[R] 15:19:46.883214 IP 21.10.10.3.isakmp > 10.32.181.200.isakmp: isakmp: child_sa inf2[I] 15:19:46.917630 IP 10.32.181.200.isakmp > 21.10.10.3.isakmp: isakmp: child_sa inf2[R]
> Can you log the size of the packets? I think these packets are not DPD/liveness packets, but the NAT-T keepalive packets (but it is confusing that I see "child_sa inf2" which does seem to suggest there is more than one byte as they read the IKE header as an informational exchange packet. (I did not see the full log attached) Paul

log with the size of the packets:
17:54:31.691073 IP (tos 0x0, ttl 64, id 60519, offset 0, flags [DF], proto UDP (17), length 108)
    21.10.10.3.isakmp > 10.32.181.200.isakmp: [udp sum ok] isakmp 2.0 msgid 00000005 cookie 7a48da5e43ab815a->dde267089c805fe6: child_sa  inf2[I]:
    (v2e: len=48)
17:54:31.724184 IP (tos 0x0, ttl 64, id 34050, offset 0, flags [DF], proto UDP (17), length 108)
    10.32.181.200.isakmp > 21.10.10.3.isakmp: [udp sum ok] isakmp 2.0 msgid 00000005 cookie 7a48da5e43ab815a->dde267089c805fe6: child_sa  inf2[R]:
    (v2e: len=48)
17:54:51.697366 IP (tos 0x0, ttl 64, id 64312, offset 0, flags [DF], proto UDP (17), length 108)
    21.10.10.3.isakmp > 10.32.181.200.isakmp: [udp sum ok] isakmp 2.0 msgid 00000006 cookie 7a48da5e43ab815a->dde267089c805fe6: child_sa  inf2[I]:
    (v2e: len=48)
17:54:51.721486 IP (tos 0x0, ttl 64, id 38279, offset 0, flags [DF], proto UDP (17), length 108)
    10.32.181.200.isakmp > 21.10.10.3.isakmp: [udp sum ok] isakmp 2.0 msgid 00000006 cookie 7a48da5e43ab815a->dde267089c805fe6: child_sa  inf2[R]:
    (v2e: len=48)
17:55:11.694771 IP (tos 0x0, ttl 64, id 2328, offset 0, flags [DF], proto UDP (17), length 108)
    21.10.10.3.isakmp > 10.32.181.200.isakmp: [udp sum ok] isakmp 2.0 msgid 00000007 cookie 7a48da5e43ab815a->dde267089c805fe6: child_sa  inf2[I]:
    (v2e: len=48)
17:55:11.721194 IP (tos 0x0, ttl 64, id 42937, offset 0, flags [DF], proto UDP (17), length 108)
    10.32.181.200.isakmp > 21.10.10.3.isakmp: [udp sum ok] isakmp 2.0 msgid 00000007 cookie 7a48da5e43ab815a->dde267089c805fe6: child_sa  inf2[R]:
    (v2e: len=48)

The full log is attached here again: [pluto.log](https://github.com/libreswan/libreswan/files/8314814/pluto.log)

**Comment by hdlk** [comment]
> ```
> Mar 21 15:19:16.882119: | liveness: https://github.com/libreswan/libreswan/issues/2 scheduling next check for 10.32.181.200:500 in 10 seconds (successful exchange was 9.972834 seconds ago)
> Mar 21 15:19:16.882156: | event_schedule_where: newref EVENT_v2_LIVENESS-pe@0x55a0120260 timeout in 10 seconds for https://github.com/libreswan/libreswan/issues/2
> ```
> 
> Two things:
> 
> * it should have re-scheduled the timer for 0.027166s, not 10s (I suspect 10s is 9.972834s rounded which points  to the bug)
> * there should probably be some fuzz added when comparing times

Is there any solution or patch to avoid this problem

**Comment by hdlk** [comment]
> ```
> Mar 21 15:19:16.882119: | liveness: https://github.com/libreswan/libreswan/issues/2 scheduling next check for 10.32.181.200:500 in 10 seconds (successful exchange was 9.972834 seconds ago)
> Mar 21 15:19:16.882156: | event_schedule_where: newref EVENT_v2_LIVENESS-pe@0x55a0120260 timeout in 10 seconds for https://github.com/libreswan/libreswan/issues/2
> ```
> 
> Two things:
> 
> * it should have re-scheduled the timer for 0.027166s, not 10s (I suspect 10s is 9.972834s rounded which points  to the bug)
> * there should probably be some fuzz added when comparing times

Is there any solution or patch to avoid this problem？thanks.

**Comment by cagney** [comment]
Mainline's been updated.
