### ISSUE TITLE
openbsd test vm running ntpd

### ISSUE THREAD

**Issue by cagney** [libreswan/libreswan#432]
and talking out the swandefault interface ...:
16:08:39.546608 IP 192.168.234.137.25059 > bernard.domain: 41563+ AAAA? pool.ntp.org. (30)
16:08:39.546870 IP bernard.domain > 192.168.234.137.25059: 41563 0/0/0 (30)
16:08:39.547029 IP 192.168.234.137.20021 > time.cloudflare.com.ntp: NTPv4, Client, length 48

**Comment by letoams** [comment]
@RaviTejaCMS do you want to have a look at disabling ntp ?

**Comment by RaviTejaCMS** [comment]
Yes,
Changing `Start ntpd(8) by default? = no` in install.conf should fix that
