### ISSUE TITLE
Total IPsec connections: loaded 3, active 1

### ISSUE THREAD

**Issue by balainit** [libreswan/libreswan#701]
[root@ipsec-server-1-4:~]# uname -ar
Linux ipsec-server-1-4 3.10.0-1160.el7.x86_64 #1 SMP Mon Oct 19 16:18:59 UTC 2020 x86_64 x86_64 x86_64 GNU/Linux
[root@ipsec-server-1-4:~]# cat /etc/centos-release
CentOS Linux release 7.9.2009 (Core)

A firewall(123.23.83.156) ---->  B firewall(172.16.253.66) ----> C firewall(172.16.88.254) -----> ipsec 172.16.88.4 

cat  office_ipsec.conf

```
conn office_ipsec
        #oe=off
        authby=secret
        compress=no
        auto=start
        ikev2=yes
        protostack=netkey
        keyexchange=ike
        #nat_traversal=yes
        #forceencaps=yes
        ike=aes128-sha2_256;modp2048
        ikelifetime=86400s
        #left=%defaultroute
        left=172.16.88.4
        leftsourceip=123.23.83.156
        leftid=123.23.83.156
        #leftnexthop=%defaultroute
        #leftnexthop=172.16.251.99
        leftsubnets={172.16.88.0/24 100.64.0.0/16 10.98.0.0/16}
        right=111.6.104.110
        rightid=111.6.104.110
        rightsourceip=111.6.104.110
        #rightnexthop=%defaultroute
        #rightnexthop=%defaultroute
        rightsubnet=192.168.0.0/20
        phase2=esp
        phase2alg=aes128-sha2_256;modp2048
        pfs=yes
        salifetime=3600s
        type=tunnel
        dpddelay=15
        dpdtimeout=45
        dpdaction=restart_by_peer
```

[root@ipsec-server-1-4:~]# ipsec verify

```
Verifying installed system and configuration files

Version check and ipsec on-path                   	[OK]
Libreswan 3.25 (netkey) on 3.10.0-1160.el7.x86_64
Checking for IPsec support in kernel              	[OK]
 NETKEY: Testing XFRM related proc values
         ICMP default/send_redirects              	[OK]
         ICMP default/accept_redirects            	[OK]
         XFRM larval drop                         	[OK]
Pluto ipsec.conf syntax                           	[OK]
Two or more interfaces found, checking IP forwarding	[OK]
Checking rp_filter                                	[OK]
Checking that pluto is running                    	[OK]
 Pluto listening for IKE on udp 500               	[OK]
 Pluto listening for IKE/NAT-T on udp 4500        	[OK]
 Pluto ipsec.secret syntax                        	[OK]
Checking 'ip' command                             	[OK]
Checking 'iptables' command                       	[OK]
Checking 'prelink' command does not interfere with FIPS	[OK]
Checking for obsolete ipsec.conf options          	[OK]

```

ipsec status

```
000 Connection list:
000  
000 "office_ipsec/1x0": 172.16.88.0/24===172.16.88.4<172.16.88.4>[123.23.83.156]...111.6.104.110<111.6.104.110>===192.168.0.0/20; erouted; eroute owner: #5
000 "office_ipsec/1x0":     oriented; my_ip=123.23.83.156; their_ip=111.6.104.110; my_updown=ipsec _updown;
000 "office_ipsec/1x0":   xauth us:none, xauth them:none,  my_username=[any]; their_username=[any]
000 "office_ipsec/1x0":   our auth:secret, their auth:secret
000 "office_ipsec/1x0":   modecfg info: us:none, them:none, modecfg policy:push, dns:unset, domains:unset, banner:unset, cat:unset;
000 "office_ipsec/1x0":   labeled_ipsec:no;
000 "office_ipsec/1x0":   policy_label:unset;
000 "office_ipsec/1x0":   ike_life: 86400s; ipsec_life: 3600s; replay_window: 32; rekey_margin: 540s; rekey_fuzz: 100%; keyingtries: 0;
000 "office_ipsec/1x0":   retransmit-interval: 500ms; retransmit-timeout: 60s;
000 "office_ipsec/1x0":   initial-contact:no; cisco-unity:no; fake-strongswan:no; send-vendorid:no; send-no-esp-tfc:no;
000 "office_ipsec/1x0":   policy: PSK+ENCRYPT+TUNNEL+PFS+UP+IKEV1_ALLOW+IKEV2_ALLOW+IKEV2_PROPOSE+SAREF_TRACK+IKE_FRAG_ALLOW+ESN_NO;
000 "office_ipsec/1x0":   conn_prio: 24,20; interface: eth0; metric: 0; mtu: unset; sa_prio:auto; sa_tfc:none;
000 "office_ipsec/1x0":   nflog-group: unset; mark: unset; vti-iface:unset; vti-routing:no; vti-shared:no; nic-offload:auto;
000 "office_ipsec/1x0":   our idtype: ID_IPV4_ADDR; our id=123.23.83.156; their idtype: ID_IPV4_ADDR; their id=111.6.104.110
000 "office_ipsec/1x0":   dpd: action:restart; delay:15; timeout:45; nat-t: encaps:auto; nat_keepalive:yes; ikev1_natt:both
000 "office_ipsec/1x0":   newest ISAKMP SA: #4; newest IPsec SA: #5;
000 "office_ipsec/1x0":   aliases: office_ipsec

000 "office_ipsec/1x0":   IKE algorithms: AES_CBC_128-HMAC_SHA2_256-MODP2048
000 "office_ipsec/1x0":   IKEv2 algorithm newest: AES_CBC_128-HMAC_SHA2_256-MODP2048
000 "office_ipsec/1x0":   ESP algorithms: AES_CBC_128-HMAC_SHA2_256_128-MODP2048
000 "office_ipsec/1x0":   ESP algorithm newest: AES_CBC_128-HMAC_SHA2_256_128; pfsgroup=MODP2048
000 "office_ipsec/2x0": 100.64.0.0/16===172.16.88.4<172.16.88.4>[123.23.83.156]...111.6.104.110<111.6.104.110>===192.168.0.0/20; unrouted; eroute owner: #0
000 "office_ipsec/2x0":     oriented; my_ip=123.23.83.156; their_ip=111.6.104.110; my_updown=ipsec _updown;
000 "office_ipsec/2x0":   xauth us:none, xauth them:none,  my_username=[any]; their_username=[any]
000 "office_ipsec/2x0":   our auth:secret, their auth:secret
000 "office_ipsec/2x0":   modecfg info: us:none, them:none, modecfg policy:push, dns:unset, domains:unset, banner:unset, cat:unset;
000 "office_ipsec/2x0":   labeled_ipsec:no;
000 "office_ipsec/2x0":   policy_label:unset;
000 "office_ipsec/2x0":   ike_life: 86400s; ipsec_life: 3600s; replay_window: 32; rekey_margin: 540s; rekey_fuzz: 100%; keyingtries: 0;
000 "office_ipsec/2x0":   retransmit-interval: 500ms; retransmit-timeout: 60s;
000 "office_ipsec/2x0":   initial-contact:no; cisco-unity:no; fake-strongswan:no; send-vendorid:no; send-no-esp-tfc:no;
000 "office_ipsec/2x0":   policy: PSK+ENCRYPT+TUNNEL+PFS+UP+IKEV1_ALLOW+IKEV2_ALLOW+IKEV2_PROPOSE+SAREF_TRACK+IKE_FRAG_ALLOW+ESN_NO;
000 "office_ipsec/2x0":   conn_prio: 16,20; interface: eth0; metric: 0; mtu: unset; sa_prio:auto; sa_tfc:none;
000 "office_ipsec/2x0":   nflog-group: unset; mark: unset; vti-iface:unset; vti-routing:no; vti-shared:no; nic-offload:auto;
000 "office_ipsec/2x0":   our idtype: ID_IPV4_ADDR; our id=123.23.83.156; their idtype: ID_IPV4_ADDR; their id=111.6.104.110
000 "office_ipsec/2x0":   dpd: action:restart; delay:15; timeout:45; nat-t: encaps:auto; nat_keepalive:yes; ikev1_natt:both
000 "office_ipsec/2x0":   newest ISAKMP SA: #0; newest IPsec SA: #0;
000 "office_ipsec/2x0":   aliases: office_ipsec

000 "office_ipsec/2x0":   IKE algorithms: AES_CBC_128-HMAC_SHA2_256-MODP2048
000 "office_ipsec/2x0":   ESP algorithms: AES_CBC_128-HMAC_SHA2_256_128-MODP2048
000 "office_ipsec/3x0": 10.98.0.0/16===172.16.88.4<172.16.88.4>[123.23.83.156]...111.6.104.110<111.6.104.110>===192.168.0.0/20; unrouted; eroute owner: #0
000 "office_ipsec/3x0":     oriented; my_ip=123.23.83.156; their_ip=111.6.104.110; my_updown=ipsec _updown;
000 "office_ipsec/3x0":   xauth us:none, xauth them:none,  my_username=[any]; their_username=[any]
000 "office_ipsec/3x0":   our auth:secret, their auth:secret
000 "office_ipsec/3x0":   modecfg info: us:none, them:none, modecfg policy:push, dns:unset, domains:unset, banner:unset, cat:unset;
000 "office_ipsec/3x0":   labeled_ipsec:no;
000 "office_ipsec/3x0":   policy_label:unset;
000 "office_ipsec/3x0":   ike_life: 86400s; ipsec_life: 3600s; replay_window: 32; rekey_margin: 540s; rekey_fuzz: 100%; keyingtries: 0;
000 "office_ipsec/3x0":   retransmit-interval: 500ms; retransmit-timeout: 60s;
000 "office_ipsec/3x0":   initial-contact:no; cisco-unity:no; fake-strongswan:no; send-vendorid:no; send-no-esp-tfc:no;
000 "office_ipsec/3x0":   policy: PSK+ENCRYPT+TUNNEL+PFS+UP+IKEV1_ALLOW+IKEV2_ALLOW+IKEV2_PROPOSE+SAREF_TRACK+IKE_FRAG_ALLOW+ESN_NO;
000 "office_ipsec/3x0":   conn_prio: 16,20; interface: eth0; metric: 0; mtu: unset; sa_prio:auto; sa_tfc:none;
000 "office_ipsec/3x0":   nflog-group: unset; mark: unset; vti-iface:unset; vti-routing:no; vti-shared:no; nic-offload:auto;
000 "office_ipsec/3x0":   our idtype: ID_IPV4_ADDR; our id=123.23.83.156; their idtype: ID_IPV4_ADDR; their id=111.6.104.110
000 "office_ipsec/3x0":   dpd: action:restart; delay:15; timeout:45; nat-t: encaps:auto; nat_keepalive:yes; ikev1_natt:both
000 "office_ipsec/3x0":   newest ISAKMP SA: #0; newest IPsec SA: #0;
000 "office_ipsec/3x0":   aliases: office_ipsec

000 "office_ipsec/3x0":   IKE algorithms: AES_CBC_128-HMAC_SHA2_256-MODP2048
000 "office_ipsec/3x0":   ESP algorithms: AES_CBC_128-HMAC_SHA2_256_128-MODP2048
000  
000 Total IPsec connections: loaded 3, active 1
000  
000 State Information: DDoS cookies not required, Accepting new IKE connections
000 IKE SAs: total(5), half-open(4), open(0), authenticated(1), anonymous(0)
000 IPsec SAs: total(1), authenticated(1), anonymous(0)
000  
000 #4: "office_ipsec/1x0":10468 STATE_PARENT_R2 (received v2I2, PARENT SA established); EVENT_SA_REPLACE in 85512s; newest ISAKMP; idle; import:respond to stranger
000 #5: "office_ipsec/1x0":10468 STATE_V2_IPSEC_R (IPsec SA established); EVENT_SA_REPLACE in 2712s; newest IPSEC; eroute owner; isakmp#4; idle; import:respond to stranger
000 #5: "office_ipsec/1x0" esp.c373a63b@111.6.104.110 esp.33293e20@172.16.88.4 tun.0@111.6.104.110 tun.0@172.16.88.4 ref=0 refhim=0 Traffic: ESPin=2KB ESPout=1KB! ESPmax=0B 
000 #41: "office_ipsec/2x0":500 STATE_PARENT_I1 (sent v2I1, expected v2R1); EVENT_v2_RETRANSMIT in 18s; idle; import:admin initiate
000 #41: pending CHILD SA for "office_ipsec/3x0"
000 #41: pending CHILD SA for "office_ipsec/2x0"
000 #43: "office_ipsec/2x0":500 STATE_PARENT_I1 (sent v2I1, expected v2R1); EVENT_v2_RETRANSMIT in 2s; idle; import:admin initiate
000 #43: pending CHILD SA for "office_ipsec/3x0"
000 #43: pending CHILD SA for "office_ipsec/2x0"
000 #40: "office_ipsec/3x0":500 STATE_PARENT_I1 (sent v2I1, expected v2R1); EVENT_v2_RETRANSMIT in 2s; idle; import:admin initiate
000 #40: pending CHILD SA for "office_ipsec/2x0"
000 #40: pending CHILD SA for "office_ipsec/3x0"
000 #42: "office_ipsec/3x0":500 STATE_PARENT_I1 (sent v2I1, expected v2R1); EVENT_v2_RETRANSMIT in 10s; idle; import:admin initiate
000 #42: pending CHILD SA for "office_ipsec/2x0"
000 #42: pending CHILD SA for "office_ipsec/3x0"
000  
000 Bare Shunt list:
000  
```

cat /var/log/pluto.log

```
Apr 29 11:30:35.781481: "office_ipsec/3x0" #109: ignoring informational payload NO_PROPOSAL_CHOSEN, msgid=00000000, length=12
Apr 29 11:30:35.781502: | ISAKMP Notification Payload
Apr 29 11:30:35.781508: |   00 00 00 0c  00 00 00 01  01 00 00 0e
Apr 29 11:30:35.781514: "office_ipsec/3x0" #109: received and ignored informational message
Apr 29 11:30:35.782689: "office_ipsec/2x0" #110: ignoring informational payload NO_PROPOSAL_CHOSEN, msgid=00000000, length=12
Apr 29 11:30:35.782700: | ISAKMP Notification Payload
Apr 29 11:30:35.782705: |   00 00 00 0c  00 00 00 01  01 00 00 0e
Apr 29 11:30:35.782711: "office_ipsec/2x0" #110: received and ignored informational message
Apr 29 11:30:40.793853: "office_ipsec/2x0" #112: STATE_PARENT_I1: retransmission; will wait 32 seconds for response
Apr 29 11:30:40.793925: "office_ipsec/3x0" #111: STATE_PARENT_I1: retransmission; will wait 32 seconds for response
Apr 29 11:30:40.802723: "office_ipsec/3x0" #111: STATE_PARENT_I1: received unauthenticated v2N_NO_PROPOSAL_CHOSEN - ignored
Apr 29 11:30:40.802747: "office_ipsec/2x0" #112: STATE_PARENT_I1: received unauthenticated v2N_NO_PROPOSAL_CHOSEN - ignored
Apr 29 11:30:41.752755: "office_ipsec/3x0" #113: STATE_PARENT_I1: retransmission; will wait 32 seconds for response
Apr 29 11:30:41.752824: "office_ipsec/1x0" #115: STATE_PARENT_I1: retransmission; will wait 32 seconds for response
Apr 29 11:30:41.752849: "office_ipsec/2x0" #114: STATE_PARENT_I1: retransmission; will wait 32 seconds for response
Apr 29 11:30:41.761331: "office_ipsec/3x0" #113: STATE_PARENT_I1: received unauthenticated v2N_NO_PROPOSAL_CHOSEN - ignored
Apr 29 11:30:41.761571: "office_ipsec/1x0" #115: STATE_PARENT_I1: received unauthenticated v2N_NO_PROPOSAL_CHOSEN - ignored
Apr 29 11:30:41.762292: "office_ipsec/2x0" #114: STATE_PARENT_I1: received unauthenticated v2N_NO_PROPOSAL_CHOSEN - ignored
Apr 29 11:30:41.834477: "office_ipsec/2x0" #117: STATE_PARENT_I1: retransmission; will wait 16 seconds for response
Apr 29 11:30:41.841638: "office_ipsec/2x0" #117: STATE_PARENT_I1: received unauthenticated v2N_NO_PROPOSAL_CHOSEN - ignored
Apr 29 11:30:49.709574: pending IPsec SA negotiation with 111.6.104.110 "office_ipsec/3x0" took too long -- replacing phase 1
Apr 29 11:30:49.709628: pending IPsec SA negotiation with 111.6.104.110 "office_ipsec/2x0" took too long -- replacing phase 1
Apr 29 11:30:49.709651: pending IPsec SA negotiation with 111.6.104.110 "office_ipsec/1x0" took too long -- replacing phase 1
Apr 29 11:30:49.709694: "office_ipsec/2x0" #118: initiating v2 parent SA to replace #110
Apr 29 11:30:49.709728: "office_ipsec/2x0" #110: deleting state (STATE_MAIN_I1) and NOT sending notification
Apr 29 11:30:49.709735: "office_ipsec/2x0" #110: deleting IKE SA for connection 'office_ipsec/2x0' but connection is supposed to remain up; schedule EVENT_REVIVE_CONNS
Apr 29 11:30:49.710618: "office_ipsec/2x0" #118: STATE_PARENT_I1: sent v2I1, expected v2R1
Apr 29 11:30:49.720835: "office_ipsec/2x0" #118: STATE_PARENT_I1: received unauthenticated v2N_NO_PROPOSAL_CHOSEN - ignored
Apr 29 11:30:49.797010: "office_ipsec/3x0" #116: STATE_PARENT_I1: retransmission; will wait 32 seconds for response
Apr 29 11:30:49.803761: "office_ipsec/3x0" #116: STATE_PARENT_I1: received unauthenticated v2N_NO_PROPOSAL_CHOSEN - ignored
Apr 29 11:30:50.211246: "office_ipsec/2x0" #118: STATE_PARENT_I1: retransmission; will wait 0.5 seconds for response
Apr 29 11:30:50.217910: "office_ipsec/2x0" #118: STATE_PARENT_I1: received unauthenticated v2N_NO_PROPOSAL_CHOSEN - ignored
Apr 29 11:30:50.712269: "office_ipsec/2x0" #118: STATE_PARENT_I1: retransmission; will wait 1 seconds for response
Apr 29 11:30:50.719485: "office_ipsec/2x0" #118: STATE_PARENT_I1: received unauthenticated v2N_NO_PROPOSAL_CHOSEN - ignored
Apr 29 11:30:51.713555: "office_ipsec/2x0" #118: STATE_PARENT_I1: retransmission; will wait 2 seconds for response
Apr 29 11:30:51.719842: "office_ipsec/2x0" #118: STATE_PARENT_I1: received unauthenticated v2N_NO_PROPOSAL_CHOSEN - ignored

```

tcpdump -n -i eth0 esp or udp port 500 or udp port 4500

```
11:52:13.552985 IP 172.16.88.4.ipsec-nat-t > 111.6.104.110.10468: UDP-encap: ESP(spi=0xc373a63b,seq=0x35ed), length 360
11:52:13.554108 IP 111.6.104.110.10468 > 172.16.88.4.ipsec-nat-t: UDP-encap: ESP(spi=0x33293e20,seq=0x1db7), length 88
11:52:13.554135 IP 172.16.88.4.ipsec-nat-t > 111.6.104.110.10468: UDP-encap: ESP(spi=0xc373a63b,seq=0x35ee), length 248
11:52:13.554208 IP 172.16.88.4.ipsec-nat-t > 111.6.104.110.10468: UDP-encap: ESP(spi=0xc373a63b,seq=0x35ef), length 360
11:52:13.557882 IP 111.6.104.110.10468 > 172.16.88.4.ipsec-nat-t: UDP-encap: ESP(spi=0x33293e20,seq=0x1db8), length 88
11:52:13.557909 IP 172.16.88.4.ipsec-nat-t > 111.6.104.110.10468: UDP-encap: ESP(spi=0xc373a63b,seq=0x35f0), length 248
11:52:13.557983 IP 172.16.88.4.ipsec-nat-t > 111.6.104.110.10468: UDP-encap: ESP(spi=0xc373a63b,seq=0x35f1), length 360
11:52:13.561222 IP 111.6.104.110.10468 > 172.16.88.4.ipsec-nat-t: UDP-encap: ESP(spi=0x33293e20,seq=0x1db9), length 88
11:52:13.561251 IP 172.16.88.4.ipsec-nat-t > 111.6.104.110.10468: UDP-encap: ESP(spi=0xc373a63b,seq=0x35f2), length 248
11:52:13.561328 IP 172.16.88.4.ipsec-nat-t > 111.6.104.110.10468: UDP-encap: ESP(spi=0xc373a63b,seq=0x35f3), length 360
11:52:13.561402 IP 172.16.88.4.ipsec-nat-t > 111.6.104.110.10468: UDP-encap: ESP(spi=0xc373a63b,seq=0x35f4), length 248
11:52:13.562874 IP 111.6.104.110.10468 > 172.16.88.4.ipsec-nat-t: UDP-encap: ESP(spi=0x33293e20,seq=0x1dba), length 88
11:52:13.562902 IP 172.16.88.4.ipsec-nat-t > 111.6.104.110.10468: UDP-encap: ESP(spi=0xc373a63b,seq=0x35f5), length 248
11:52:13.562979 IP 111.6.104.110.10468 > 172.16.88.4.ipsec-nat-t: UDP-encap: ESP(spi=0x33293e20,seq=0x1dbb), length 120
11:52:13.563013 IP 172.16.88.4.ipsec-nat-t > 111.6.104.110.10468: UDP-encap: ESP(spi=0xc373a63b,seq=0x35f6), length 360
```

Hi everyone, my ipesc has three subnets, why only one subnet is established, and the remaining two subnets cannot be established?

**Comment by cagney** [comment]
Sticking with left right:
```
left = ipsec 172.16.88.4 -> firewall(172.16.88.254)  ...
                 firewall(172.16.253.66) ---->  firewall(123.23.83.156) = right
```
we see:
- RIGHT initiates and establishes office_ipsec/1x0 with LEFT
- LEFT tries to establish office_ipsec/2x0 and office_ipsec/3x0 as child SAs
- RIGHT rejects the Child SA with NO_PROPOSAL_CHOSEN

NO_PROPOSAL_CHOSEN could mean that the esp=line is dud or could mean that subnets= entry is dud, or ...  Best thing is to look at RIGHTs logs.

LEFT is running v3.30?  And RIGHT?  Any chance you can try this with mainline (which is meant to be 4.7 real soon).  Since v4.4, the Child SA code has seen continuous improvement.

**Comment by letoams** [comment]
Are you sure both ends have the same subnet configurations ? No proposal chosen suggests you didn’t ?

Sent using a virtual keyboard on a phone

**Comment by paulwouters** [comment]
feel free to re-open if this is still and issue or if you have new information
