### ISSUE TITLE
Not respond to isakmp packet with multiple nics, while kernel print "IPv4: martian source" "ll header: 00000000" in log

### ISSUE THREAD

**Issue by imlibra** [libreswan/libreswan#1736]
hostnamectl
```
 Static hostname: instance-me
       Icon name: computer-vm
         Chassis: vm 🖴
      Machine ID: fa2db99038f044ad937603fc9f089c13
         Boot ID: 0ac845a17eae41c38d105f2ac32dc266
  Virtualization: kvm
Operating System: CentOS Stream 9                 
     CPE OS Name: cpe:/o:centos:centos:9
          Kernel: Linux 5.14.0-457.el9.x86_64
    Architecture: x86-64
 Hardware Vendor: Google
  Hardware Model: Google Compute Engine
Firmware Version: Google
```
ifconfig
```
eth0: flags=4163<UP,BROADCAST,RUNNING,MULTICAST>  mtu 1460
        inet 172.31.0.2  netmask 255.255.255.255  broadcast 0.0.0.0
        inet6 2600:1900:4031:559::  prefixlen 128  scopeid 0x0<global>
        inet6 fe80::dfd7:8532:222b:db9  prefixlen 64  scopeid 0x20<link>
        ether 42:01:ac:1f:00:02  txqueuelen 1000  (Ethernet)
        RX packets 2158  bytes 341967 (333.9 KiB)
        RX errors 0  dropped 0  overruns 0  frame 0
        TX packets 1502  bytes 267459 (261.1 KiB)
        TX errors 0  dropped 0 overruns 0  carrier 0  collisions 0

eth1: flags=4163<UP,BROADCAST,RUNNING,MULTICAST>  mtu 1460
        inet 172.31.1.2  netmask 255.255.255.255  broadcast 172.31.1.2
        inet6 fe80::4001:acff:fe1f:102  prefixlen 64  scopeid 0x20<link>
        ether 42:01:ac:1f:01:02  txqueuelen 1000  (Ethernet)
        RX packets 172  bytes 32888 (32.1 KiB)
        RX errors 0  dropped 0  overruns 0  frame 0
        TX packets 107  bytes 5058 (4.9 KiB)
        TX errors 0  dropped 0 overruns 0  carrier 0  collisions 0

lo: flags=73<UP,LOOPBACK,RUNNING>  mtu 65536
        inet 127.0.0.1  netmask 255.0.0.0
        inet6 ::1  prefixlen 128  scopeid 0x10<host>
        loop  txqueuelen 1000  (Local Loopback)
        RX packets 0  bytes 0 (0.0 B)
        RX errors 0  dropped 0  overruns 0  frame 0
        TX packets 0  bytes 0 (0.0 B)
        TX errors 0  dropped 0 overruns 0  carrier 0  collisions 0
```

/etc/ipsec.conf
```
config setup
   uniqueids=no

conn internet-cert
   left=172.31.1.2
   leftcert="domain.name"
   leftid=@my.domain.name
   leftsendcert=always
   leftsubnet=0.0.0.0/0
   leftrsasigkey=%cert
   right=%any
   rightaddresspool=10.10.1.1-10.10.1.254
   rightca="vpn-auth-ca"
   rightrsasigkey=%cert
   narrowing=yes
   dpddelay=30
   dpdtimeout=120
   dpdaction=clear
   rekey=no
   fragmentation=yes
   auto=add

#include /etc/crypto-policies/back-ends/libreswan.config

include /etc/ipsec.d/*.conf
```
journalctl -f

```
Jun 16 16:26:56 instance-me pluto[2576]: "internet-cert": added IKEv2 connection
Jun 16 16:26:56 instance-me pluto[2576]: listening for IKE messages
Jun 16 16:26:56 instance-me pluto[2576]: Kernel supports NIC esp-hw-offload
Jun 16 16:26:56 instance-me pluto[2576]: skipping interface eth0 with 172.31.0.2
Jun 16 16:26:56 instance-me pluto[2576]: skipping interface lo with 127.0.0.1
Jun 16 16:26:56 instance-me pluto[2576]: skipping interface lo with ::1
Jun 16 16:26:56 instance-me pluto[2576]: skipping interface eth0 with 2600:1900:4031:559::
Jun 16 16:26:56 instance-me pluto[2576]: adding UDP interface eth1 172.31.1.2:500
Jun 16 16:26:56 instance-me pluto[2576]: adding UDP interface eth1 172.31.1.2:4500
Jun 16 16:26:56 instance-me pluto[2576]: forgetting secrets
Jun 16 16:26:56 instance-me pluto[2576]: loading secrets from "/etc/ipsec.secrets"
Jun 16 16:26:56 instance-me pluto[2576]: no secrets filename matched "/etc/ipsec.d/*.secrets"
Jun 16 16:28:47 instance-me kernel: IPv4: martian source 172.31.1.2 from 111.194.208.237, on dev eth1
Jun 16 16:28:47 instance-me kernel: ll header: 00000000: 42 01 ac 1f 01 02 42 01 ac 1f 01 01 08 00
Jun 16 16:28:49 instance-me kernel: IPv4: martian source 172.31.1.2 from 111.194.208.237, on dev eth1
Jun 16 16:28:49 instance-me kernel: ll header: 00000000: 42 01 ac 1f 01 02 42 01 ac 1f 01 01 08 00
Jun 16 16:28:52 instance-me kernel: IPv4: martian source 172.31.1.2 from 111.194.208.237, on dev eth1
Jun 16 16:28:52 instance-me kernel: ll header: 00000000: 42 01 ac 1f 01 02 42 01 ac 1f 01 01 08 00
```

tcpdump -i eth1
```
dropped privs to tcpdump
tcpdump: verbose output suppressed, use -v[v]... for full protocol decode
listening on eth1, link-type EN10MB (Ethernet), snapshot length 262144 bytes
16:29:30.198935 IP xxx.xxx.xxx.xxx.30874 > 172.31.1.2.500: isakmp: parent_sa ikev2_init[I]
16:29:31.636371 IP6 fe80::4001:acff:fe1f:101 > ff02::1: ICMP6, router advertisement, length 56
16:29:32.205331 IP xxx.xxx.xxx.xxx.30874 > 172.31.1.2.500: isakmp: parent_sa ikev2_init[I]
16:29:35.008208 IP xxx.xxx.xxx.xxx.30874 > 172.31.1.2.500: isakmp: parent_sa ikev2_init[I]
```
