### ISSUE TITLE
low speed in gre tunnel inside ipsec with  esp_offload

### ISSUE THREAD

**Issue by AnatoliChe** [libreswan/libreswan#415]
Hi!
I have strange problem with speed.
case 1
esp_offload is unload in kernel
speed of ipsec is about 5Gb/s
speed in gre tunnel over ipsec the same (5Gb/s)

As only I load esp_offload in kernel
speed of ipsec is about 10 Gb/s
but speed in gre tunnel over ipsec only 0.2Gb/s.

phase2alg=aes_gcm128-null
replay-window=0
10G X550T
Libreswan 4.2rc1np (netkey)
kernel 5.10.13 and 5.4.xx
cryptd_max_cpu_qlen = 4096 and
cryptd_max_cpu_qlen = 1000
no difference

Could you help, maybe any idea with what it can be related?

**Comment by bleve** [comment]
Those are issues with kernel offload. Libreswan only set those up. I think there are some limitations with Intel offload like it only supporting transport mode.

**Comment by AnatoliChe** [comment]
Seems problem in kernel.
Not intel's problem.
'cause if I set 
phase2alg=aes-sha2
xfrm=AES_CBC_128-HMAC_SHA2_256_128
ixgbe driver says: "Unsupported Ipsec algorithm"
speed in ipsec 2GB/s
but speed inside gre 0.2Gb/s

The same with lan card without esp offload
as only I have esp_offload in kernel.

**Comment by bleve** [comment]
Test to disable offload in libreswan. Add nic-offload=no to the conn. There have been reports that you need to disable offloading for some netword drivers which don't support offloading at all.

**Comment by AnatoliChe** [comment]
It's strange thing

esp=aes_gcm128-null
nic-offload=no
004 "point3-point2" #4: IPsec SA established transport mode {ESP=>0x1feffa2c <0x5572ed3a xfrm=AES_GCM_16_128-NONE NATOA=none NATD=none DPD=active}
000 "point3-point2":   nflog-group: unset; mark: unset; vti-iface:unset; vti-routing:no; vti-shared:no; nic-offload:no;
speed in ipsec 8.96 Gbits/sec
speed in gre 159 Mbits/sec

if I unload esp module then ipsec 5Gb/s and gre 5Gb/s
loaded esp_offload and  nic-offload:no 9Gb/s ipsec and 0.2Gb/s in gre

**Comment by letoams** [comment]
For intel you need type=transport

Paul

**Comment by letoams** [comment]
Did you increase replay-window= to something like 256 or 1024 ? The default 32 might not be good enough?

Also check MTU, are you causing fragmentation and doubling the packets needed to be encrypted ?

**Comment by AnatoliChe** [comment]
Sure it's transport mode. 

and with nic-offload=no I have in log:
Feb  6 19:05:41.061417: | NIC esp-hw-offload disabled for connection 'point3-point2'
with nic-offload auto:
Feb  6 19:07:57.075636: | netlink: esp-hw-offload set via interface eth2 for IPsec SA
Feb  6 19:07:57.075672: | netlink response for Add SA esp.5878f796@172.21.0.203 included non-error error

but does not matter what with nic-offload, if kernel module in I have 9Gb/s in ipsec and 0.2Gbs in gre.

Strange thing.

**Comment by AnatoliChe** [comment]
> Did you increase replay-window= to something like 256 or 1024 ? The default 32 might not be good enough? Also check MTU, are you causing fragmentation and doubling the packets needed to be encrypted ?

Oh, with replay-window I have other fine thing.
If replay-window=32 and esp_offload I have seend in ipsec
iperf3 -P1 speed 9Gb
iperf3 -P2 speed 3Gb
without esp_offload speed in ipsec
iperf3 -P1 speed 5Gb
iperf3 -P2 speed 5Gb
With replay-window=1024 iperf3 -P2 end have 9Gbs with offload

So for tests I set replay-window=0

with mtu 9000 I have  I have speed ipsec without offload 9Gb.

so for test I set 
eth2 mtu 9000
gre mtu 1500
and have speed in ipsec 9Gb/s
speed in gre 0.2Gb/s

eth2 mtu 9000
and increase
gre mtu 8500
and have speed in ipsec 9Gb/s
speed in gre 0.8Gb/s

**Comment by AnatoliChe** [comment]
I had suspicion problem related with my distr. So I installed fresh debian buster, ipsec nss db, ipsec conf
peer2 192.168.0.2 mtu 1500
peer3 192.168.0.3 mtu 1500
conn point3-point2
        auto=start
	type=transport
        phase2alg=aes_gcm128-null
	replay-window=0
	nic-offload=no
	left=192.168.0.2
        leftid=@point2
	leftrsasigkey=@AwEAAbAU1
        right=192.168.0.3
        rightid=@point3
	rightrsasigkey=@AwEAAdWEO
up gre tunnel
ip tunnel add gdint mode gre local 192.168.0.3 remote 192.168.0.2 ttl 255
ip link set gdint mtu 1400 up
ip addr add dev gdint 10.10.10.3 peer 10.10.10.2

start sa
002 "point3-point2" #6: negotiated connection [192.168.0.3-192.168.0.3:0-65535 0] -> [192.168.0.2-192.168.0.2:0-65535 0]
004 "point3-point2" #6: IPsec SA established transport mode {ESP=>0xba1244bf <0x7fb32c40 xfrm=AES_GCM_16_128-NONE-MODP2048 NATOA=none NATD=none DPD=active}

now ping from 192.168.0.3: ## ping 192.168.0.2 -c1
PING 192.168.0.2 (192.168.0.2) 56(84) bytes of data.
64 bytes from 192.168.0.2: icmp_seq=1 ttl=64 time=0.096 ms

tcpdump no peer2:
# tcpdump -ni enp1s0f1
20:15:22.295847 IP 192.168.0.3 > 192.168.0.2: ICMP echo request, id 3403, seq 1, length 64
20:15:22.295857 IP 192.168.0.2 > 192.168.0.3: ESP(spi=0x7fb32c40,seq=0x6), length 100


tcpdump no peer3:
# tcpdump -ni enp1s0f1
21:15:13.422768 IP 192.168.0.3 > 192.168.0.2: ESP(spi=0xba1244bf,seq=0x8), length 100
21:15:13.422893 IP 192.168.0.2 > 192.168.0.3: ICMP echo reply, id 3403, seq 1, length 64


It's strange sniff, on the miirror port I can see only ESP 
if I onload esp4_offload tcpdump show only ESP, not icmp

ok speedwith iperf3
root@peer3:~# iperf3 -c 192.168.0.2 
[  5]   0.00-10.00  sec  9.73 GBytes  8.36 Gbits/sec  213             sender
[  5]   0.00-10.04  sec  9.72 GBytes  8.32 Gbits/sec                  receiver

root@peer3:~# iperf3 -c 10.10.10.2
[ ID] Interval           Transfer     Bitrate         Retr
[  5]   0.00-10.00  sec   363 MBytes   305 Mbits/sec  68085             sender
[  5]   0.00-10.04  sec   363 MBytes   304 Mbits/sec                  receiver

if ipsec down
ipsec stop
root@peer3:~# iperf3 -c 10.10.10.2
[ ID] Interval           Transfer     Bitrate         Retr
[  5]   0.00-10.00  sec  10.7 GBytes  9.22 Gbits/sec    0             sender
[  5]   0.00-10.04  sec  10.7 GBytes  9.19 Gbits/sec                  receiver


Look's like esp4_offload unmark packets and gre offload works in 20 times slowers

Without esp4_offload
I have 6Gb/s with iperf3  in gre over ipsec.

kernel 4.19,  5.4, 5.10 


ohI I can see alot of errors like
[Sun Feb  7 21:23:08 2021] ixgbe 0000:03:00.1 enp3s0f1: ixgbe_ipsec_tx: bad sa_idx=64512 handle=0
when do iperf inside gre

strange thing 'case nic_offload=no
000 "point3-point2":   nflog-group: unset; mark: unset; vti-iface:unset; vti-routing:no; vti-shared:no; nic-offload:no;


at least I can google this error, and not very nice solution CONFIG_IXGBE_IPSEC=n
but I have the same behavior with  i40e.


Ok. it's really weird situation with kernel/ixgbe driver but why nic_offload=no do not switch off offload?

Sorry for the long boring reading guys.

**Comment by letoams** [comment]
We have relayed this to the IPsec kernel people. We will let you know if we hear back

**Comment by AnatoliChe** [comment]
Thank you!
Yes, I realized it's not related with libreswan when setup ipsec transport with ip xfrm by hands (with and without esp4_offload module)
I guess it old kernel "feature". Do you think is there any chance to change it?

**Comment by AnatoliChe** [comment]
Thanks Steffen Klassert and other developers for patches.
Commit 94579ac3f6d0.

**Comment by paulwouters** [comment]
see https://osdn.net/projects/android-x86/scm/git/kernel/commits/855150a762385644a8cf6535e5ec40a08207d8e7
