### ISSUE TITLE
f41: bonus packets in `ikev1-xauth-32-lost-mode-cfg`

### ISSUE THREAD

**Issue by cagney** [libreswan/libreswan#2146]
### What needs to be done

The test sends only one packet, but by the time the connection is deleted it's found a few more.
```
 ipsec trafficstatus
#2: "road-east-modecfg-yes", username=xroad, type=ESP, add_time=1234567890, inBytes=0, outBytes=0, maxBytes=2^63B, lease=192.0.2.101/32
road #
 ../../guestbin/ping-once.sh --up -I 192.0.2.101 192.0.2.254
up
road #
 ipsec trafficstatus
#2: "road-east-modecfg-yes", username=xroad, type=ESP, add_time=1234567890, inBytes=84, outBytes=84, maxBytes=2^63B, lease=192.0.2.101/32
road #
 sleep 5
road #
 ipsec down road-east-modecfg-yes
"road-east-modecfg-yes": initiating delete of connection's IPsec SA #2 and ISAKMP SA #1
"road-east-modecfg-yes" #2: deleting IPsec SA (QUICK_I2) and sending notification using ISAKMP SA #1
"road-east-modecfg-yes" #2: ESP traffic information: in=84B out=308B XAUTHuser=xroad
```
`308B` should still be `84B`.  A tcp dump shows:
```
# ../../guestbin/tcpdump.sh -i eth0 --stop
reading from file OUTPUT/road.ikev1-xauth-32-lost-mode-cfg.eth0.tcpdump.pcap, link-type EN10MB (Ethernet), snapshot length 262144
dropped privs to tcpdump
09:57:10.333668 IP 192.1.3.209.51803 > 193.0.14.129.domain: 46685% [1au] NS? . (28)
09:57:10.710246 IP 192.1.3.209.34451 > 192.58.128.30.domain: 40011% [1au] NS? . (28)
09:57:11.086827 IP 192.1.3.209.36234 > 170.247.170.2.domain: 59647% [1au] NS? . (28)
09:57:11.391899 IP 192.1.3.209.isakmp > 192.1.2.23.isakmp: isakmp: phase 1 I ident
09:57:11.552974 IP 192.1.2.23.isakmp > 192.1.3.209.isakmp: isakmp: phase 1 R ident
09:57:11.584645 IP 192.1.3.209.isakmp > 192.1.2.23.isakmp: isakmp: phase 1 I ident
09:57:11.628692 IP 192.1.2.23.isakmp > 192.1.3.209.isakmp: isakmp: phase 1 R ident
09:57:11.708558 IP 192.1.3.209.ipsec-nat-t > 192.1.2.23.ipsec-nat-t: NONESP-encap: isakmp: phase 1 I ident[E]
09:57:11.708572 IP 192.1.3.209 > 192.1.2.23: ip-proto-17
09:57:11.839881 IP 192.1.3.209.47802 > 192.33.4.12.domain: 34062% [1au] NS? . (28)
09:57:11.851735 IP 192.1.2.23.ipsec-nat-t > 192.1.3.209.ipsec-nat-t: NONESP-encap: isakmp: phase 1 R ident[E]
09:57:11.851736 IP 192.1.2.23 > 192.1.3.209: ip-proto-17
09:57:11.943867 IP 192.1.2.23.ipsec-nat-t > 192.1.3.209.ipsec-nat-t: NONESP-encap: isakmp: phase 2/others R #6[E]
09:57:11.961512 IP 192.1.3.209.ipsec-nat-t > 192.1.2.23.ipsec-nat-t: NONESP-encap: isakmp: phase 2/others I #6[E]
09:57:11.978049 IP 192.1.2.23.ipsec-nat-t > 192.1.3.209.ipsec-nat-t: NONESP-encap: isakmp: phase 2/others R #6[E]
09:57:11.992023 IP 192.1.3.209.ipsec-nat-t > 192.1.2.23.ipsec-nat-t: NONESP-encap: isakmp: phase 2/others I #6[E]
09:57:12.003866 IP 192.1.3.209.ipsec-nat-t > 192.1.2.23.ipsec-nat-t: NONESP-encap: isakmp: phase 2/others I #6[E]
09:57:12.024256 IP 192.1.2.23.ipsec-nat-t > 192.1.3.209.ipsec-nat-t: NONESP-encap: isakmp: phase 2/others R #6[E]
09:57:12.099222 IP 192.1.3.209.ipsec-nat-t > 192.1.2.23.ipsec-nat-t: NONESP-encap: isakmp: phase 2/others I oakley-quick[E]
09:57:12.170696 IP 192.1.2.23.ipsec-nat-t > 192.1.3.209.ipsec-nat-t: NONESP-encap: isakmp: phase 2/others R oakley-quick[E]
09:57:12.216376 IP 192.1.3.209.59503 > 192.203.230.10.domain: 53185% [1au] NS? . (28)
09:57:12.270922 IP 192.1.3.209.ipsec-nat-t > 192.1.2.23.ipsec-nat-t: NONESP-encap: isakmp: phase 2/others I oakley-quick[E]
09:57:12.467875 IP 192.1.3.209.ipsec-nat-t > 192.1.2.23.ipsec-nat-t: UDP-encap: ESP(spi=0xbea5dca6,seq=0x1), length 132
09:57:12.468225 IP 192.1.2.23.ipsec-nat-t > 192.1.3.209.ipsec-nat-t: UDP-encap: ESP(spi=0xd318b6eb,seq=0x1), length 132
09:57:12.468225 IP 192.0.2.254 > 192.0.2.101: ICMP echo reply, id 809, seq 1, length 64
09:57:12.592946 IP 192.1.3.209.ipsec-nat-t > 192.1.2.23.ipsec-nat-t: UDP-encap: ESP(spi=0xbea5dca6,seq=0x2), length 100
09:57:13.345881 IP 192.1.3.209.ipsec-nat-t > 192.1.2.23.ipsec-nat-t: UDP-encap: ESP(spi=0xbea5dca6,seq=0x3), length 100
09:57:13.722371 IP 192.1.3.209.ipsec-nat-t > 192.1.2.23.ipsec-nat-t: UDP-encap: ESP(spi=0xbea5dca6,seq=0x4), length 100
09:57:14.475361 IP 192.1.3.209.ipsec-nat-t > 192.1.2.23.ipsec-nat-t: UDP-encap: ESP(spi=0xbea5dca6,seq=0x5), length 100
```
there's three extra outbound bytes.

**Comment by cagney** [comment]
Note this packet:
```
09:57:12.216376 IP 192.1.3.209.59503 > 192.203.230.10.domain: 53185% [1au] NS? . (28)
```
why would the test talk to a real DNS server (suspect the bonus packets are retransmits).  Poking around, this turns up:
```
unbound-anchor.timer                                                         loaded active waiting   daily update of the root trust anchor for DNSSEC
```

**Comment by cagney** [comment]
Disabling `unbound-anchor.timer` seems to make the problem go away.  OTOH, so to does re-building the VM :-(
