### ISSUE TITLE
Error in connecting Libreswan server with StrongSwan client.

### ISSUE THREAD

**Issue by Fire-Cream** [libreswan/libreswan#2327]
Server：Ubuntu 24.04
ikev2.conf

conn ikev2-cp
left=%defaultroute
leftcert=xx.xx.xx.xx
leftsendcert=always
leftsubnet=192.168.44.0/24
leftrsasigkey=%cert
right=%any
rightid=%fromcert
rightaddresspool=192.168.44.10-192.168.44.250
rightca=%same
rightrsasigkey=%cert
narrowing=yes
dpddelay=30
retransmit-timeout=300s
dpdaction=clear
auto=add
ikev2=insist
rekey=no
pfs=no
ike=aes_gcm_c_256-hmac_sha2_256-ecp_256,aes256-sha2,aes128-sha2,aes256-sha1,aes128-sha1
phase2alg=aes_gcm-null,aes128-sha1,aes256-sha1,aes128-sha2,aes256-sha2
ikelifetime=24h
salifetime=24h
encapsulation=yes
leftid=xx.xx.xx.xx
modecfgdns="8.8.8.8 8.8.4.4"
mobike=no

client：GL-MT3000
strongswan-full
ikev2-client.conf配置文件

connections {

ikev2-vpn {
version = 2

  local_addrs  = 10.99.11.1
  remote_addrs = xx.xx.xx.xx

  local {
     auth = pubkey
     certs = client.cer
     id = vpnclient
  }
  remote {
     auth = pubkey
  }
  children {
     net {
        mode = tunnel
        local_ts = 0.0.0.0/0
        remote_ts = 192.168.44.0/24
        updown = /usr/local/libexec/ipsec/_updown iptables
        esp_proposals = aes128-sha256-x25519
     }
  }
  proposals = aes128-sha256-x25519
  pools = ikev2-pool
}
}
pools {
ikev2-pool {
addrs = 192.168.44.10-192.168.44.250
}
}

Window client can connect normally by IKev2 connection, GL-MT3000 connects to server, but it can't. I tried to set leftmodecfgserver=false, which doesn't take effect. The log is as follows.

Jun 29 19:02:14 iZbp13kohcqyui7tdvk84bZ pluto[115460]: | rw_responder_instantiate: remote=117.152.206.84 id= kind=TEMPLATE sec_label= (find_v2_unset_peer_connection() +385 programs/pluto/ikev2_host_pair.c)
Jun 29 19:02:14 iZbp13kohcqyui7tdvk84bZ pluto[115460]: | connection $3: "ikev2-cp"
Jun 29 19:02:14 iZbp13kohcqyui7tdvk84bZ pluto[115460]: | host: 172.19.186.2->0.0.0.0
Jun 29 19:02:14 iZbp13kohcqyui7tdvk84bZ pluto[115460]: | id: xx.xx.xx.xx -> %fromcert
Jun 29 19:02:14 iZbp13kohcqyui7tdvk84bZ pluto[115460]: | routing+kind: UNROUTED TEMPLATE
Jun 29 19:02:14 iZbp13kohcqyui7tdvk84bZ pluto[115460]: | selectors: 192.168.44.0/24 -> 192.168.44.10-192.168.44.250 ->; lease: -> ->
Jun 29 19:02:14 iZbp13kohcqyui7tdvk84bZ pluto[115460]: | spds: 192.168.44.0/24===192.168.44.10-192.168.44.250
Jun 29 19:02:14 iZbp13kohcqyui7tdvk84bZ pluto[115460]: | policy: IKEv2+RSASIG+ECDSA+RSASIG_v1_5+ENCRYPT+TUNNEL+DONT_REKEY+IKEV2_ALLOW_NARROWING+IKE_FRAG_ALLOW+ESN_NO+ESN_YES
Jun 29 19:02:14 iZbp13kohcqyui7tdvk84bZ pluto[115460]: | rw_responder_instantiate: from "ikev2-cp" (find_v2_unset_peer_connection() +385 programs/pluto/ikev2_host_pair.c)
Jun 29 19:02:14 iZbp13kohcqyui7tdvk84bZ pluto[115460]: | connection $4 clonedfrom $3: "ikev2-cp"[1] 117.152.206.84
Jun 29 19:02:14 iZbp13kohcqyui7tdvk84bZ pluto[115460]: | host: 172.19.186.2->117.152.206.84
Jun 29 19:02:14 iZbp13kohcqyui7tdvk84bZ pluto[115460]: | id: xx.xx.xx.xx -> %fromcert
Jun 29 19:02:14 iZbp13kohcqyui7tdvk84bZ pluto[115460]: | routing+kind: UNROUTED INSTANCE
Jun 29 19:02:14 iZbp13kohcqyui7tdvk84bZ pluto[115460]: | selectors: 192.168.44.0/24 -> 192.168.44.10-192.168.44.250 ->; lease: -> ->
Jun 29 19:02:14 iZbp13kohcqyui7tdvk84bZ pluto[115460]: | spds: 192.168.44.0/24===192.168.44.10-192.168.44.250
Jun 29 19:02:14 iZbp13kohcqyui7tdvk84bZ pluto[115460]: | policy: IKEv2+RSASIG+ECDSA+RSASIG_v1_5+ENCRYPT+TUNNEL+DONT_REKEY+IKEV2_ALLOW_NARROWING+IKE_FRAG_ALLOW+ESN_NO+ESN_YES
Jun 29 19:02:14 iZbp13kohcqyui7tdvk84bZ pluto[115460]: "ikev2-cp"[1] 117.152.206.84 https://github.com/hwdsl2/setup-ipsec-vpn/pull/1: processing IKE_SA_INIT request from 117.152.206.84:UDP/6217 containing SA,KE,Ni,N(NAT_DETECTION_SOURCE_IP),N(NAT_DETECTION_DESTINATION_IP),N(IKEV2_FRAGMENTATION_SUPPORTED),N(SIGNATURE_HASH_ALGORITHMS),N(REDIRECT_SUPPORTED)
Jun 29 19:02:14 iZbp13kohcqyui7tdvk84bZ pluto[115460]: "ikev2-cp"[1] 117.152.206.84 https://github.com/hwdsl2/setup-ipsec-vpn/pull/1: proposal 1:IKE=AES_CBC_128-HMAC_SHA2_256-HMAC_SHA2_256_128-CURVE25519 chosen from remote proposals 1:IKE:ENCR=AES_CBC_128;INTEG=HMAC_SHA2_256_128;PRF=HMAC_SHA2_256;DH=CURVE25519[first-match]
Jun 29 19:02:14 iZbp13kohcqyui7tdvk84bZ pluto[115460]: "ikev2-cp"[1] 117.152.206.84 https://github.com/hwdsl2/setup-ipsec-vpn/pull/1: sent IKE_SA_INIT response to 117.152.206.84:UDP/6217 {cipher=AES_CBC_128 integ=HMAC_SHA2_256_128 prf=HMAC_SHA2_256 group=DH31}
Jun 29 19:02:14 iZbp13kohcqyui7tdvk84bZ pluto[115460]: "ikev2-cp"[1] 117.152.206.84 https://github.com/hwdsl2/setup-ipsec-vpn/pull/1: received IKE_AUTH request fragment 1 (1 of 2), computing DH in the background
Jun 29 19:02:14 iZbp13kohcqyui7tdvk84bZ pluto[115460]: "ikev2-cp"[1] 117.152.206.84 https://github.com/hwdsl2/setup-ipsec-vpn/pull/1: processing decrypted IKE_AUTH request from 117.152.206.84:UDP/6608 containing SK{IDi,CERT,CERTREQ,AUTH,SA,TSi,TSr,N(MOBIKE_SUPPORTED),N(ADDITIONAL_IP4_ADDRESS),N(ADDITIONAL_IP6_ADDRESS),N(ADDITIONAL_IP6_ADDRESS),N(EAP_ONLY_AUTHENTICATION),N(IKEV2_MESSAGE_ID_SYNC_SUPPORTED)}
Jun 29 19:02:14 iZbp13kohcqyui7tdvk84bZ pluto[115460]: adding the CA+root cert O=IKEv2 VPN,CN=IKEv2 VPN CA
Jun 29 19:02:14 iZbp13kohcqyui7tdvk84bZ pluto[115460]: "ikev2-cp"[1] 117.152.206.84 https://github.com/hwdsl2/setup-ipsec-vpn/pull/1: reloaded private key matching left certificate 'xx.xx.xx.xx'
Jun 29 19:02:14 iZbp13kohcqyui7tdvk84bZ pluto[115460]: "ikev2-cp"[1] 117.152.206.84 https://github.com/hwdsl2/setup-ipsec-vpn/pull/1: responder established IKE SA; authenticated peer certificate 'CN=vpnclient, O=IKEv2 VPN' and 3072-bit PKCS#1 1.5 RSA with SHA2_256 digital signature issued by 'CN=IKEv2 VPN CA, O=IKEv2 VPN'
Jun 29 19:02:14 iZbp13kohcqyui7tdvk84bZ pluto[115460]: "ikev2-cp"[1] 117.152.206.84 https://github.com/hwdsl2/setup-ipsec-vpn/pull/1: IKE_AUTH request does not include a CP payload required by leftmodecfgserver=true; Child SA ignored

Log of GL-MT3000

[IKE] initiating IKE_SA ikev2-vpn[30] to xx.xx.xx.xx
[ENC] generating IKE_SA_INIT request 0 [ SA KE No N(NATD_S_IP) N(NATD_D_IP) N(FRAG_SUP) N(HASH_ALG) N(REDIR_SUP) ]
[NET] sending packet: from 10.99.11.1[500] to xx.xx.xx.xx[500] (240 bytes)
[NET] received packet: from xx.xx.xx.xx[500] to 10.99.11.1[500] (263 bytes)
[ENC] parsed IKE_SA_INIT response 0 [ SA KE No N(FRAG_SUP) N(HASH_ALG) N(NATD_S_IP) N(NATD_D_IP) N(CHDLESS_SUP) CERTREQ ]
[CFG] selected proposal: IKE:AES_CBC_128/HMAC_SHA2_256_128/PRF_HMAC_SHA2_256/CURVE_25519
[IKE] local host is behind NAT, sending keep alives
[IKE] remote host is behind NAT
[IKE] received cert request for "CN=IKEv2 VPN CA, O=IKEv2 VPN"
[IKE] sending cert request for "CN=IKEv2 VPN CA, O=IKEv2 VPN"
[IKE] authentication of 'vpnclient' (myself) with RSA_EMSA_PKCS1_SHA2_256 successful
[IKE] sending end entity cert "CN=vpnclient, O=IKEv2 VPN"
[IKE] establishing CHILD_SA net{372}
[ENC] generating IKE_AUTH request 1 [ IDi CERT CERTREQ AUTH SA TSi TSr N(MOBIKE_SUP) N(ADD_4_ADDR) N(ADD_6_ADDR) N(ADD_6_ADDR) N(EAP_ONLY) N(MSG_ID_SYN_SUP) ]
[ENC] splitting IKE message (1760 bytes) into 2 fragments
[ENC] generating IKE_AUTH request 1 [ EF(1/2) ]
[ENC] generating IKE_AUTH request 1 [ EF(2/2) ]
[NET] sending packet: from 10.99.11.1[4500] to xx.xx.xx.xx[4500] (1236 bytes)
[NET] sending packet: from 10.99.11.1[4500] to xx.xx.xx.xx[4500] (596 bytes)
[NET] received packet: from xx.xx.xx.xx[4500] to 10.99.11.1[4500] (532 bytes)
[ENC] parsed IKE_AUTH response 1 [ EF(1/4) ]
[ENC] received fragment https://github.com/hwdsl2/setup-ipsec-vpn/pull/1 of 4, waiting for complete IKE message
[NET] received packet: from xx.xx.xx.xx[4500] to 10.99.11.1[4500] (532 bytes)
[ENC] parsed IKE_AUTH response 1 [ EF(2/4) ]
[ENC] received fragment https://github.com/hwdsl2/setup-ipsec-vpn/issues/2 of 4, waiting for complete IKE message
[NET] received packet: from xx.xx.xx.xx[4500] to 10.99.11.1[4500] (532 bytes)
[ENC] parsed IKE_AUTH response 1 [ EF(3/4) ]
[ENC] received fragment https://github.com/hwdsl2/setup-ipsec-vpn/issues/3 of 4, waiting for complete IKE message
[NET] received packet: from xx.xx.xx.xx[4500] to 10.99.11.1[4500] (180 bytes)
[ENC] parsed IKE_AUTH response 1 [ EF(4/4) ]
[ENC] received fragment https://github.com/hwdsl2/setup-ipsec-vpn/issues/4 of 4, reassembled fragmented IKE message (1552 bytes)
[ENC] parsed IKE_AUTH response 1 [ IDr CERT AUTH N(FAIL_CP_REQ) ]
[IKE] received end entity cert "CN=xx.xx.xx.xx, O=IKEv2 VPN"
[CFG] using certificate "CN=xx.xx.xx.xx, O=IKEv2 VPN"
[CFG] using trusted ca certificate "CN=IKEv2 VPN CA, O=IKEv2 VPN"
[CFG] checking certificate status of "CN=xx.xx.xx.xx, O=IKEv2 VPN"
[CFG] certificate status is not available
[CFG] reached self-signed root ca with a path length of 0
[IKE] authentication of 'xx.xx.xx.xx' with RSA_EMSA_PKCS1_SHA2_256 successful
[IKE] IKE_SA ikev2-vpn[30] established between 10.99.11.1[vpnclient]...xx.xx.xx.xx[xx.xx.xx.xx]
[IKE] scheduling rekeying in 13071s
[IKE] maximum IKE_SA lifetime 14511s
[IKE] received FAILED_CP_REQUIRED notify, no CHILD_SA built
[IKE] failed to establish CHILD_SA, keeping IKE_SA
initiate failed: establishing CHILD_SA 'net' failed

**Comment by Fire-Cream** [comment]
After modifying the connection configuration, you can connect, but after the client is closed, the IKE_SA of the server will not be removed, resulting in subsequent connection failure.

**Comment by bleve** [comment]
with dpddelay=30s, you want retransmit-timeout=45s to rip old tunnel to be cleared when client vanishes, by liveness probes.

Also note you might still need dpdtimeout=45 together with retransmit-timeout=45 with 4.14 version of libreswan.

retransmit-timeout=300s is insanely long time for single packet timeout - if there is any packet drop between server and client, it's sure you can't connect.

**Comment by Fire-Cream** [comment]
Now I have replaced both the client and the server with Libreswan.

Version of the client：4.14

Version of the server: 5.2

Configuration of client:
```
conn vpn.xxx.com
	auto=add            		
	ikev2=insist        		
	mobike=no					
	rekey=no					
	fragmentation=yes			
	narrowing=yes				
	ike=aes_gcm_c_256-hmac_sha2_256-ecp_256,aes256-sha2,aes128-sha2,aes256-sha1,aes128-sha1
	phase2alg=aes_gcm-null,aes128-sha1,aes256-sha1,aes128-sha2,aes256-sha2
	authby=rsa-sha1
    modecfgdns="8.8.8.8 8.8.4.4"
    pfs=no
    retransmit-timeout=300s
    ikelifetime=24h
    salifetime=24h
    encapsulation=yes
    dpddelay=30
    dpdtimeout=90
    dpdaction=clear
    reauth=no

	left=%defaultroute			
	leftid=%fromcert			
	leftsubnet=10.99.10.0/24	
	leftmodecfgclient=yes		
	leftcert=GL-MT3000			
	leftrsasigkey=%cert			

	right=xx.xx.xx.xx			
	rightid=xx.xx.xx.xx		
	rightsubnet=10.99.11.0/24	
```
Configuration of the server:
```
conn ikev2-cp
    auto=add            		        
    keyexchange=ikev2        		     
    mobike=no	      	     
    rekey=no	       	     		
    fragmentation=yes	  	     	  
    narrowing=yes	        			
    ike=aes_gcm_c_256-hmac_sha2_256-ecp_256,aes256-sha2,aes128-sha2,aes256-sha1,aes128-sha1
    phase2alg=aes_gcm-null,aes128-sha1,aes256-sha1,aes128-sha2,aes256-sha2
    authby=rsa-sha1
    modecfgdns="8.8.8.8 8.8.4.4"
    pfs=no
    retransmit-timeout=300s
    ikelifetime=24h
    salifetime=24h
    encapsulation=yes
    dpddelay=30
    reauth=no

    left=%defaultroute			     
    leftid=xx.xx.xx.xx        
    leftsubnet=10.99.11.0/24
    leftcert=xx.xx.xx.xx
    leftsendcert=always
    leftrsasigkey=%cert

    right=%any
    rightid=%fromcert
    rightca=%same
    rightrsasigkey=%cert
    rightaddresspool=10.99.10.100-10.99.10.250
```

I found an error in the client log.   **/usr/libexec/ipsec/_updown.xfrm: 411: cannot create /etc/resolv.conf: Permission denied**
```
181 "vpn.xxx.com"[1] xx.xx.xx.xx #1: initiating IKEv2 connection
181 "vpn.xxx.com"[1] xx.xx.xx.xx #1: sent IKE_SA_INIT request to xx.xx.xx.xx:500
182 "vpn.xxx.com"[1] xx.xx.xx.xx #1: sent IKE_AUTH request {cipher=AES_GCM_16_256 integ=n/a prf=HMAC_SHA2_256 group=DH19}
003 "vpn.xxx.com"[1] xx.xx.xx.xx #1: initiator established IKE SA; authenticated peer '3072-bit PKCS#1 1.5 RSA with SHA1' signature using peer certificate 'xx.xx.xx.xx' issued by CA 'CN=IKEv2 VPN CA, O=IKEv2 VPN'
002 "vpn.xxx.com"[1] xx.xx.xx.xx #2: received INTERNAL_IP4_ADDRESS 10.99.10.101
002 "vpn.xxx.com"[1] xx.xx.xx.xx #2: received INTERNAL_IP4_DNS 8.8.8.8
002 "vpn.xxx.com"[1] xx.xx.xx.xx #2: received INTERNAL_IP4_DNS 8.8.4.4
002 "vpn.xxx.com"[1] xx.xx.xx.xx #2: up-client output: updating resolvconf
002 "vpn.xxx.com"[1] xx.xx.xx.xx #2: up-client output: /usr/libexec/ipsec/_updown.xfrm: 411: cannot create /etc/resolv.conf: Permission denied
004 "vpn.xxx.com"[1] xx.xx.xx.xx #2: initiator established Child SA using #1; IPsec tunnel [10.99.10.101-10.99.10.101:0-65535 0] -> [10.99.11.0-10.99.11.255:0-65535 0] {ESPinUDP/ESN=>0x53e29e46 <0x8a5906e9 xfrm=AES_GCM_16_128-NONE NATD=xx.xx.xx.xx:4500 DPD=active}
```

**Comment by Fire-Cream** [comment]
I reinstalled the system.I now have three test equipments, namely a cloud server, a raspberry pie 5 and a virtual machine.

The cloud server uses the server installed by **setup-ipsec-vpn**.Raspberry pie and virtual machine are the packages in the default warehouse.I don't know if the version of Libreswan will affect the connection.

| equipment              | Version        |
| ---------------------- | -------------- |
| Cloud server           | Libreswan 5.2  |
| Raspberry pie 5        | Libreswan 4.10 |
| Ubuntu virtual machine | Libreswan 4.14 |

Configuration file of server

```
conn ikev2-cp
    auto=add            		        
    keyexchange=ikev2        		       
    mobike=no	      	     			
    rekey=no	       	     			
    fragmentation=yes	  	     	    
    narrowing=yes	        			
    ike=aes_gcm_c_256-hmac_sha2_256-ecp_256,aes256-sha2,aes128-sha2,aes256-sha1,aes128-sha1
    phase2alg=aes_gcm-null,aes128-sha1,aes256-sha1,aes128-sha2,aes256-sha2
    authby=rsa-sha1
    modecfgdns="8.8.8.8 8.8.4.4"
    pfs=no
    retransmit-timeout=300s
    ikelifetime=24h
    salifetime=24h
    encapsulation=yes
    dpddelay=30
    reauth=no

    left=%defaultroute			    
    leftid=xx.xx.xx.xx
    leftsubnet=10.99.0.0/16
    leftcert=xx.xx.xx.xx
    leftsendcert=always
    leftrsasigkey=%cert

    right=%any
    rightid=%fromcert
    rightca=%same
    rightrsasigkey=%cert
    rightaddresspool=10.99.10.100-10.99.10.250
```

Client's configuration file

```
conn vpn.com
	auto=add 
	ikev2=insist        		
	mobike=no					
	rekey=no					
	fragmentation=yes			
	narrowing=yes				
	ike=aes_gcm_c_256-hmac_sha2_256-ecp_256,aes256-sha2,aes128-sha2,aes256-sha1,aes128-sha1
	phase2alg=aes_gcm-null,aes128-sha1,aes256-sha1,aes128-sha2,aes256-sha2
	authby=rsa-sha1
    modecfgdns="8.8.8.8 8.8.4.4"
    pfs=no
    ikelifetime=24h
    salifetime=24h
    encapsulation=yes
    dpddelay=30
    dpdaction=clear
    reauth=no
    retransmit-timeout=300s

	left=%defaultroute			
	leftid=%fromcert			
	leftsubnet=10.99.0.0/16
	leftmodecfgclient=yes		
	leftcert=xxxxx		
	leftrsasigkey=%cert			

	right=xx.xx.xx.xx	
	rightid=xx.xx.xx.xx		
	rightsubnet=10.99.0.0/16
```

The problem now is that clients ping each other, and the server can catch the data, but it can't reach the corresponding client.

The following is the relevant log

```
root@iZbp13kohcqyui7tdvk84bZ:~# sudo ip xfrm policy
src 10.99.0.0/16 dst 10.99.10.101/32 
        dir out priority 1761472 
        tmpl src 172.19.186.2 dst 117.152.206.84
                proto esp reqid 16441 mode tunnel
src 10.99.10.101/32 dst 10.99.0.0/16 
        dir fwd priority 1761472 
        tmpl src 117.152.206.84 dst 172.19.186.2
                proto esp reqid 16441 mode tunnel
src 10.99.10.101/32 dst 10.99.0.0/16 
        dir in priority 1761472 
        tmpl src 117.152.206.84 dst 172.19.186.2
                proto esp reqid 16441 mode tunnel
src 10.99.0.0/16 dst 10.99.10.100/32 
        dir out priority 1761472 
        tmpl src 172.19.186.2 dst 117.152.206.84
                proto esp reqid 16433 mode tunnel
src 10.99.10.100/32 dst 10.99.0.0/16 
        dir fwd priority 1761472 
        tmpl src 117.152.206.84 dst 172.19.186.2
                proto esp reqid 16433 mode tunnel
src 10.99.10.100/32 dst 10.99.0.0/16 
        dir in priority 1761472 
        tmpl src 117.152.206.84 dst 172.19.186.2
                proto esp reqid 16433 mode tunnel
```

```
root@iZbp13kohcqyui7tdvk84bZ:~# sudo ip xfrm state
src 172.19.186.2 dst 117.152.206.84
        proto esp spi 0xd0f400ab reqid 16441 mode tunnel
        replay-window 0 flag af-unspec esn
        aead rfc4106(gcm(aes)) 0xa9c708979cf474ebf8c4ec371515c30093ece3a0 128
        encap type espinudp sport 4500 dport 6645 addr 0.0.0.0
        anti-replay esn context:
         seq-hi 0x0, seq 0x0, oseq-hi 0x0, oseq 0x0
         replay_window 128, bitmap-length 4
         00000000 00000000 00000000 00000000 
src 117.152.206.84 dst 172.19.186.2
        proto esp spi 0x7e49b09e reqid 16441 mode tunnel
        replay-window 0 flag af-unspec esn
        aead rfc4106(gcm(aes)) 0xa83e316a756edaa9624ae344257dc7d402d58e38 128
        encap type espinudp sport 6645 dport 4500 addr 0.0.0.0
        lastused 2025-07-08 22:11:03
        anti-replay esn context:
         seq-hi 0x0, seq 0x278, oseq-hi 0x0, oseq 0x0
         replay_window 128, bitmap-length 4
         ffffffff ffffffff ffffffff ffffffff 
src 172.19.186.2 dst 117.152.206.84
        proto esp spi 0x2a9d82cb reqid 16433 mode tunnel
        replay-window 0 flag af-unspec esn
        aead rfc4106(gcm(aes)) 0x618be0bcd025283e717e7c89e8e87443f71f993d 128
        encap type espinudp sport 4500 dport 6577 addr 0.0.0.0
        anti-replay esn context:
         seq-hi 0x0, seq 0x0, oseq-hi 0x0, oseq 0x0
         replay_window 128, bitmap-length 4
         00000000 00000000 00000000 00000000 
src 117.152.206.84 dst 172.19.186.2
        proto esp spi 0x391a83c9 reqid 16433 mode tunnel
        replay-window 0 flag af-unspec esn
        aead rfc4106(gcm(aes)) 0x27296467aec18c943c540e95040f28f76e1ed110 128
        encap type espinudp sport 6577 dport 4500 addr 0.0.0.0
        lastused 2025-07-08 22:11:04
        anti-replay esn context:
         seq-hi 0x0, seq 0x2ee, oseq-hi 0x0, oseq 0x0
         replay_window 128, bitmap-length 4
         ffffffff ffffffff ffffffff ffffffff 
```

```
root@iZbp13kohcqyui7tdvk84bZ:~# sudo tcpdump -i eth0 host 10.99.10.100 or host 10.99.10.101
tcpdump: verbose output suppressed, use -v[v]... for full protocol decode
listening on eth0, link-type EN10MB (Ethernet), snapshot length 262144 bytes
22:07:57.420752 ARP, Request who-has 10.99.10.100 tell iZbp13kohcqyui7tdvk84bZ, length 28
22:07:58.070559 IP 10.99.10.100 > 10.99.10.101: ICMP echo request, id 4, seq 75, length 64
22:07:58.408389 IP 10.99.10.101 > 10.99.10.100: ICMP echo request, id 7059, seq 138, length 64
22:07:58.444820 ARP, Request who-has 10.99.10.101 tell iZbp13kohcqyui7tdvk84bZ, length 28
22:07:59.094587 IP 10.99.10.100 > 10.99.10.101: ICMP echo request, id 4, seq 76, length 64
22:07:59.433288 IP 10.99.10.101 > 10.99.10.100: ICMP echo request, id 7059, seq 139, length 64
22:07:59.433370 ARP, Request who-has 10.99.10.100 tell iZbp13kohcqyui7tdvk84bZ, length 28
22:07:59.468779 ARP, Request who-has 10.99.10.101 tell iZbp13kohcqyui7tdvk84bZ, length 28
22:08:00.118899 IP 10.99.10.100 > 10.99.10.101: ICMP echo request, id 4, seq 77, length 64
22:08:00.456610 IP 10.99.10.101 > 10.99.10.100: ICMP echo request, id 7059, seq 140, length 64
22:08:00.492793 ARP, Request who-has 10.99.10.101 tell iZbp13kohcqyui7tdvk84bZ, length 28
22:08:00.492806 ARP, Request who-has 10.99.10.100 tell iZbp13kohcqyui7tdvk84bZ, length 28
```

The following is the route of the server

```
root@iZbp13kohcqyui7tdvk84bZ:~# route
Kernel IP routing table
Destination     Gateway         Genmask         Flags Metric Ref    Use Iface
default         _gateway        0.0.0.0         UG    100    0        0 eth0
10.99.10.100    0.0.0.0         255.255.255.255 UH    0      0        0 eth0
10.99.10.101    0.0.0.0         255.255.255.255 UH    0      0        0 eth0
100.100.2.136   _gateway        255.255.255.255 UGH   100    0        0 eth0
100.100.2.138   _gateway        255.255.255.255 UGH   100    0        0 eth0
172.19.176.0    0.0.0.0         255.255.240.0   U     100    0        0 eth0
_gateway        0.0.0.0         255.255.255.255 UH    100    0        0 eth0
```


I want to know if my server routing configuration is wrong. At first, my mobile phone and computer can ping each other, but I can't ping clients of other linux systems.I'm not sure if it's ikev2. I'll try L2TP again when I have time.
