### ISSUE TITLE
TFC padding isn't applied when Child SA negotiates AES-GCM

### ISSUE THREAD

**Issue by SaiKumarCholleti** [libreswan/libreswan#1569]
Hi Team, Please have a look at the below issue and share your views. Thanks.

**Environment:**
Strongswan Server and Libreswan on Ubuntu 22.04

**Description:**
Enable tfc=1280 in /etc/ipsec.conf

Verify padding is happening when Child SA is AES-CBC or AES-GCM by looking at the ESP packets generated with tcpdump.

ip -s xfrm state           
src 192.168.2.170 dst 192.168.2.246
	proto esp spi 0xcd2debd7(3442338775) reqid 16393(0x00004009) mode tunnel
	replay-window 0 seq 0x00000000 flag af-unspec (0x00100000)
	output-mark 0x4000/0xffffffff
	aead rfc4106(gcm(aes)) 0xd4ac21f04669bd4e88aebb3b3e4c2541203afcad (160 bits) 128
	anti-replay esn context:
	 seq-hi 0x0, seq 0x14, oseq-hi 0x0, oseq 0x0
	 replay_window 128, bitmap-length 4
	 00000000 00000000 00000000 000fffff 
	if_id 0x4000
	lifetime config:
	  limit: soft 9223372036854775808(bytes), hard 9223372036854775808(bytes)
	  limit: soft 9223372036854775808(packets), hard 9223372036854775808(packets)
	  expire add: soft 0(sec), hard 0(sec)
	  expire use: soft 0(sec), hard 0(sec)
	lifetime current:
	  25400(bytes), 20(packets)
	  add 2024-01-12 15:29:58 use 2024-01-12 15:29:58
	stats:
	  replay-window 0 replay 0 failed 0
src 192.168.2.246 dst 192.168.2.170
	proto esp spi 0xc78aca60(3347761760) reqid 16393(0x00004009) mode tunnel
	replay-window 0 seq 0x00000000 flag af-unspec (0x00100000)
	output-mark 0x4000/0xffffffff
	aead rfc4106(gcm(aes)) 0x2404f68673be76cace98281d302cb98f4b47c01a (160 bits) 128
	anti-replay esn context:
	 seq-hi 0x0, seq 0x0, oseq-hi 0x0, oseq 0x15
	 replay_window 128, bitmap-length 4
	 00000000 00000000 00000000 00000000 
	if_id 0x4000
	lifetime config:
	  limit: soft 9223372036854775808(bytes), hard 9223372036854775808(bytes)
	  limit: soft 9223372036854775808(packets), hard 9223372036854775808(packets)
	  expire add: soft 0(sec), hard 0(sec)
	  expire use: soft 0(sec), hard 0(sec)
	lifetime current:
	  1270(bytes), 21(packets)
	  add 2024-01-12 15:29:58 use 2024-01-12 15:29:58
	stats:
	  replay-window 0 replay 0 failed 0

When I send ping packets that go through VPN, I see that they aren't padded when leaving the device (length = 120), but they are properly padded by the StrongSwan server on return (length = 1304).

The packets are going out eth0/bond0 because primary Ethernet, secondary Ethernet, and the VPN server are all on the same subnet.  the ESP packets which contain the encrypted ICMP (ping) packets are not TFC padded.

tcpdump -i any esp
tcpdump: data link type LINUX_SLL2
tcpdump: verbose output suppressed, use -v[v]... for full protocol decode
listening on any, link-type LINUX_SLL2 (Linux cooked v2), snapshot length 262144 bytes

17:51:22.648940 bond0 Out IP 192.168.2.246 > 192.168.2.170: ESP(spi=0xc17e9e25,seq=0xc), length 120
17:51:22.648957 eth0  Out IP 192.168.2.246 > 192.168.2.170: ESP(spi=0xc17e9e25,seq=0xc), length 120
17:51:22.662446 eth1  In  IP 192.168.2.170 > 192.168.2.246: ESP(spi=0x20ee9503,seq=0xa), length 1304
17:51:23.650092 bond0 Out IP 192.168.2.246 > 192.168.2.170: ESP(spi=0xc17e9e25,seq=0xd), length 120
17:51:23.650112 eth0  Out IP 192.168.2.246 > 192.168.2.170: ESP(spi=0xc17e9e25,seq=0xd), length 120
17:51:23.662575 eth1  In  IP 192.168.2.170 > 192.168.2.246: ESP(spi=0x20ee9503,seq=0xb), length 1304
17:51:23.837931 bond0 Out IP 192.168.2.246 > 192.168.2.170: ESP(spi=0xc17e9e25,seq=0xe), length 104
17:51:23.837947 eth0  Out IP 192.168.2.246 > 192.168.2.170: ESP(spi=0xc17e9e25,seq=0xe), length 104

If I change the Child SA to be AES-CBC instead of AES-GCM, the packets are padded like we expect.
The packets are different size because I set max TFC padding to 1270 on the server so I could see a difference.

17:48:10.206592 bond0 Out IP 192.168.2.246 > 192.168.2.170: ESP(spi=0xcf7056b8,seq=0x15), length 1336
17:48:10.206611 eth0  Out IP 192.168.2.246 > 192.168.2.170: ESP(spi=0xcf7056b8,seq=0x15), length 1336
17:48:10.221560 eth1  In  IP 192.168.2.170 > 192.168.2.246: ESP(spi=0x4267e0d8,seq=0x13), length 1320
17:48:11.208233 bond0 Out IP 192.168.2.246 > 192.168.2.170: ESP(spi=0xcf7056b8,seq=0x16), length 1336
17:48:11.208255 eth0  Out IP 192.168.2.246 > 192.168.2.170: ESP(spi=0xcf7056b8,seq=0x16), length 1336
17:48:11.220703 eth1  In  IP 192.168.2.170 > 192.168.2.246: ESP(spi=0x4267e0d8,seq=0x14), length 1320
17:48:12.209384 bond0 Out IP 192.168.2.246 > 192.168.2.170: ESP(spi=0xcf7056b8,seq=0x17), length 1336
17:48:12.209406 eth0  Out IP 192.168.2.246 > 192.168.2.170: ESP(spi=0xcf7056b8,seq=0x17), length 1336

ip -s xfrm state
src 192.168.2.170 dst 192.168.2.246
	proto esp spi 0x4267e0d8(1114104024) reqid 16393(0x00004009) mode tunnel
	replay-window 0 seq 0x00000000 flag af-unspec (0x00100000)
	output-mark 0x4000/0xffffffff
	auth-trunc hmac(sha256) 0xf3c3c12fc0edca21867dfc425cfc2f4251765ea1e3d5fd28d7e956788f036dd5 (256 bits) 128
	enc cbc(aes) 0x0a5118a072134507854db98e8d117ab731e7bc5487fbaa91 (192 bits)
	anti-replay esn context:
	 seq-hi 0x0, seq 0x32, oseq-hi 0x0, oseq 0x0
	 replay_window 128, bitmap-length 4
	 00000000 00000000 0003ffff ffffffff 
	if_id 0x4000
	lifetime config:
	  limit: soft 9223372036854775808(bytes), hard 9223372036854775808(bytes)
	  limit: soft 9223372036854775808(packets), hard 9223372036854775808(packets)
	  expire add: soft 0(sec), hard 0(sec)
	  expire use: soft 0(sec), hard 0(sec)
	lifetime current:
	  63500(bytes), 50(packets)
	  add 2024-01-12 17:47:53 use 2024-01-12 17:47:53
	stats:
	  replay-window 0 replay 0 failed 0
src 192.168.2.246 dst 192.168.2.170
	proto esp spi 0xcf7056b8(3480245944) reqid 16393(0x00004009) mode tunnel
	replay-window 0 seq 0x00000000 flag af-unspec (0x00100000)
	output-mark 0x4000/0xffffffff
	auth-trunc hmac(sha256) 0xed769328e77e9ad39de71bd36b848f5c4d8716b8196d19b4d93f95f685ee3f58 (256 bits) 128
	enc cbc(aes) 0x89ee0359a68ceb9d0386482715153905bc13f13ea631bec3 (192 bits)
	anti-replay esn context:
	 seq-hi 0x0, seq 0x0, oseq-hi 0x0, oseq 0x34
	 replay_window 128, bitmap-length 4
	 00000000 00000000 00000000 00000000 
	if_id 0x4000
	**tfcpad 1280**
	lifetime config:
	  limit: soft 9223372036854775808(bytes), hard 9223372036854775808(bytes)
	  limit: soft 9223372036854775808(packets), hard 9223372036854775808(packets)
	  expire add: soft 0(sec), hard 0(sec)
	  expire use: soft 0(sec), hard 0(sec)
	lifetime current:
	  3803(bytes), 52(packets)
	  add 2024-01-12 17:47:53 use 2024-01-12 17:47:53
	stats:
	  replay-window 0 replay 0 failed 0

**Suggested Patch:**

In Libreswan 4.12, when a new SA is added and the encryption type is aead the
TFC attribute is not added to the netlink message, so in the kernel xfrm the add
SA state construct does not include TFC attribute support.  Send the TFC
attribute irrespective of the encryption type and only for proto == ESP.

[libreswan-4.12_enable_tfc_for_aead_crypto.patch](https://github.com/libreswan/libreswan/files/14012437/libreswan-4.12_enable_tfc_for_aead_crypto.patch)

After adding the patch:

cat /var/log/pluto.log | grep TFC
Jan 19 07:11:59.526809: | kernel: Enabling TFC at 1280 bytes (up to PMTU)
Jan 19 07:11:59.527121: | xfrm: setting TFC to 1280 (up to PMTU)
Jan 19 07:11:59.574821: "uplogix"[1] 192.168.50.191 #2: initiator established Child SA using #1; IPsec tunnel [10.19.48.1-10.19.48.1:0-65535 0] -> [0.0.0.0-255.255.255.255:0-65535 0] {ESP/TFC=>0xcc152f77 <0x6dec11f6 xfrm=AES_GCM_16_256-NONE DPD=active}
[root@A606000612 ~]# ip -s xfrm state
src 192.168.50.191 dst 192.168.50.141
	proto esp spi 0x6dec11f6(1844187638) reqid 16393(0x00004009) mode tunnel
	replay-window 0 seq 0x00000000 flag af-unspec (0x00100000)
	output-mark 0x4000/0xffffffff
	aead rfc4106(gcm(aes)) 0x5a7d3a69efcc01171bc3ceaac97b9aa459c0e37654521e544e0f3ae275fa017857558ff8 (288 bits) 128
	anti-replay esn context:
	 seq-hi 0x0, seq 0x1, oseq-hi 0x0, oseq 0x0
	 replay_window 128, bitmap-length 4
	 00000000 00000000 00000000 00000001
	if_id 0x4000
	lifetime config:
	  limit: soft 9223372036854775808(bytes), hard 9223372036854775808(bytes)
	  limit: soft 9223372036854775808(packets), hard 9223372036854775808(packets)
	  expire add: soft 0(sec), hard 0(sec)
	  expire use: soft 0(sec), hard 0(sec)
	lifetime current:
	  1280(bytes), 1(packets)
	  add 2024-01-19 07:11:59 use 2024-01-19 07:11:59
	stats:
	  replay-window 0 replay 0 failed 0
src 192.168.50.141 dst 192.168.50.191
	proto esp spi 0xcc152f77(3423940471) reqid 16393(0x00004009) mode tunnel
	replay-window 0 seq 0x00000000 flag af-unspec (0x00100000)
	output-mark 0x4000/0xffffffff
	aead rfc4106(gcm(aes)) 0x1fbc85046134eee8429d97c00de4f238a39f1b4ff38a95a345b8a5305fd6714fd097670d (288 bits) 128
	anti-replay esn context:
	 seq-hi 0x0, seq 0x0, oseq-hi 0x0, oseq 0x6
	 replay_window 128, bitmap-length 4
	 00000000 00000000 00000000 00000000
	if_id 0x4000
	**tfcpad 1280**
	lifetime config:
	  limit: soft 9223372036854775808(bytes), hard 9223372036854775808(bytes)
	  limit: soft 9223372036854775808(packets), hard 9223372036854775808(packets)
	  expire add: soft 0(sec), hard 0(sec)
	  expire use: soft 0(sec), hard 0(sec)
	lifetime current:
	  306(bytes), 6(packets)
	  add 2024-01-19 07:11:59 use 2024-01-19 07:11:59
	stats:
	  replay-window 0 replay 0 failed 0
