### ISSUE TITLE
IPSEC SA negotiation is not getting triggered always for the first packet

### ISSUE THREAD

**Issue by NagarajKoti** [libreswan/libreswan#1070]
Hi Experts,
      Always first  packet is not triggering the SA negotiation, either the first packet is drooped or SA negotiated, if more than one packet is sent then the second or third packet will trigger the SA negotiation. Also this issue is intermittent. 
The first packet that triggers the SA negotiation is dropped by pluto, whereas racoon used to hold the packet till the SA negotiation and then send the packet after the SA negotiation.

Highlighted in yellow text in attached reproduce.doc log where first packet is dropped or failed to negotiate. 
[reproduce.docx](https://github.com/libreswan/libreswan/files/11155425/reproduce.docx)

Below is the script to reproduce the issue.
```
#!/bin/bash
for (( i = 0; i <= 20; i++))
do
        ip a d 10.105.51.106/9 dev eno2;ipsec auto --ctlsocket /run/pluto/pluto.ctl --delete working
        ip a a 10.105.51.106/9 dev eno2;ipsec auto --ctlsocket /run/pluto/pluto.ctl --ondemand working;ping -c 1 -I 10.105.51.106 10.105.51.105
        ip xfrm stat
        sleep 3
done
```
Thanks
Koti

**Comment by cagney** [comment]
Could you please replace the **word** document with pasted text.  github's markup isn't so bad.

**Comment by NagarajKoti** [comment]
Hi Experts,

      Further on my investigation, After sending first packet providing delay 30s, SA negotiation happening for the connection, not observed any intermittent failure but this is not the case in Racoon. is it expected Libreswan behavior.

#!/bin/bash
for (( i = 0; i <= 20; i++))
do
        ip a d 10.105.51.106/9 dev eno2;ipsec auto --ctlsocket /run/pluto/pluto.ctl --delete working
        ip a a 10.105.51.106/9 dev eno2;ipsec auto --ctlsocket /run/pluto/pluto.ctl --ondemand working;ping -c 1 -I 10.105.51.106 10.105.51.105
        sleep 30s
        ip xfrm stat
        sleep 3
done

**Comment by NagarajKoti** [comment]
src 10.105.51.106 dst 10.105.51.103
        proto esp spi 0x00000000 reqid 0 mode transport
        replay-window 0
        anti-replay context: seq 0x0, oseq 0x0, bitmap 0x00000000
        sel src 10.105.51.106/32 dst 10.105.51.103/32 proto icmp type 8 code 0 dev eno1
002 "lconn-1676429804": terminating SAs using this connection
002 "lconn-1676429804": added IKEv2 connection
PING 10.105.51.103 (10.105.51.103) from 10.105.51.106 : 56(84) bytes of data.

--- 10.105.51.103 ping statistics ---
1 packets transmitted, 0 received, 100% packet loss, time 0ms

**002 "lconn-1676429804": terminating SAs using this connection**
002 "lconn-1676429804": added IKEv2 connection
PING 10.105.51.103 (10.105.51.103) from 10.105.51.106 : 56(84) bytes of data.

**Comment by NagarajKoti** [comment]
Hi Paul,
 
  Thanks for the response, i tried setting xfrmlifetime=1 in the config setup, delay reduced to 10s from 30s, but SA negotiation triggered with the first packet is dropped and it is intermittent. from the tcpdump on the partner system. only few iterations seeing the below isakmp. looks to be SA negotiation is complete but unable to reach isakmp msg to the partner machine. 

11:02:44.330524 IP dl380g10-5.ned.telco.isakmp > dl380g10-4.ned.telco.isakmp: isakmp: parent_sa ikev2_init[I]
11:02:44.338445 IP dl380g10-4.ned.telco.isakmp > dl380g10-5.ned.telco.isakmp: isakmp: parent_sa ikev2_init[R]
11:02:44.346192 IP dl380g10-5.ned.telco.isakmp > dl380g10-4.ned.telco.isakmp: isakmp: child_sa  ikev2_auth[I]
11:02:44.361106 IP dl380g10-4.ned.telco.isakmp > dl380g10-5.ned.telco.isakmp: isakmp: child_sa  ikev2_auth[R]

Thanks
Koti

**Comment by letoams** [comment]
The acquire eats non-TCP packets. So if you use ping or udp, the first packet is dropped and any delay rests with the application retrying the packet.For tcp, the first packet is cached and sent once the tunnel is up.This is a kernel feature and there will be nondifference between libreswan, raccoon or any other IKE daemonSent using a virtual keyboard on a phoneOn Apr 6, 2023, at 13:30, NagarajKoti ***@***.***> wrote:﻿
Hi Paul,
Thanks for the response, i tried setting xfrmlifetime=1 in the config setup, delay reduced to 10s from 30s, but SA negotiation triggered with the first packet is dropped and it is intermittent. from the tcpdump on the partner system. only few iterations seeing the below isakmp. looks to be SA negotiation is complete but unable to reach isakmp msg to the partner machine.
11:02:44.330524 IP dl380g10-5.ned.telco.isakmp > dl380g10-4.ned.telco.isakmp: isakmp: parent_sa ikev2_init[I]
11:02:44.338445 IP dl380g10-4.ned.telco.isakmp > dl380g10-5.ned.telco.isakmp: isakmp: parent_sa ikev2_init[R]
11:02:44.346192 IP dl380g10-5.ned.telco.isakmp > dl380g10-4.ned.telco.isakmp: isakmp: child_sa  ikev2_auth[I]
11:02:44.361106 IP dl380g10-4.ned.telco.isakmp > dl380g10-5.ned.telco.isakmp: isakmp: child_sa  ikev2_auth[R]
Thanks
Koti
